{
  "runId": "run-cli-landing-001",
  "workflow": "CREATE",
  "phase": "component-plan",
  "role": "component-architect",
  "goal": "Resolve each component requirement by reuse, composition, extension, or justified creation.",
  "scope": [
    "cli-landing-page"
  ],
  "inputs": [
    "Surface Brief",
    "component inventory",
    "DESIGN draft"
  ],
  "locks": [],
  "openDecisions": [
    "creative direction",
    "composition",
    "typography",
    "motion"
  ],
  "authority": [
    "Inventory, reuse, compose, extend, or propose components and state contracts.",
    "must not: invent components before querying the existing registry",
    "must not: hand-roll accessible primitives without reason"
  ],
  "skillKit": {
    "primary": "chromarelay-components",
    "supporting": [
      "storybook"
    ]
  },
  "outputSchema": "framework/schemas/handoff.schema.json",
  "acceptance": [
    "produce: Component Plan",
    "produce: component state contracts",
    "satisfy or report gate: component-reuse"
  ],
  "exitPolicy": "all critical component requirements have a resolution",
  "nonGoals": [
    "pricing page",
    "documentation site",
    "backend"
  ],
  "omittedContext": [
    "unrelated project documents",
    "unrelated Run history",
    "Skills outside the active kit"
  ],
  "independenceControls": []
}
