{
  "runId": "run-cli-landing-001",
  "workflow": "CREATE",
  "phase": "surface-architecture",
  "role": "product-strategist",
  "goal": "Define information hierarchy, focal point, actions, responsive transformations, and state matrix.",
  "scope": [
    "cli-landing-page"
  ],
  "inputs": [
    "Product Brief",
    "Selected Direction",
    "DESIGN draft"
  ],
  "locks": [],
  "openDecisions": [
    "creative direction",
    "composition",
    "typography",
    "motion"
  ],
  "authority": [
    "Clarify user, task, product truth, constraints, desired perception, and information architecture.",
    "must not: pick visual details before product intent",
    "must not: invent product facts"
  ],
  "skillKit": {
    "primary": "chromarelay-grounding",
    "supporting": []
  },
  "outputSchema": "framework/schemas/handoff.schema.json",
  "acceptance": [
    "produce: Surface Brief",
    "produce: Information Architecture",
    "produce: Responsive Model",
    "produce: State Matrix"
  ],
  "exitPolicy": "Surface contracts are implementation-ready",
  "nonGoals": [
    "pricing page",
    "documentation site",
    "backend"
  ],
  "omittedContext": [
    "unrelated project documents",
    "unrelated Run history",
    "Skills outside the active kit"
  ],
  "independenceControls": []
}
