{
  "runId": "run-cli-landing-001",
  "workflow": "CREATE",
  "phase": "canonization",
  "role": "system-architect",
  "goal": "Translate the Selected Direction into design grammar, tokens, scope, exceptions, and Locks.",
  "scope": [
    "cli-landing-page"
  ],
  "inputs": [
    "Selected Direction",
    "Product Brief",
    "Constraints"
  ],
  "locks": [],
  "openDecisions": [
    "creative direction",
    "composition",
    "typography",
    "motion"
  ],
  "authority": [
    "Translate the selected Direction into design grammar, tokens, scopes, exceptions, and contracts.",
    "must not: dilute a selected Direction for implementation convenience",
    "must not: promote directly"
  ],
  "skillKit": {
    "primary": "chromarelay-systemize",
    "supporting": [
      "google-design-md"
    ]
  },
  "outputSchema": "framework/schemas/handoff.schema.json",
  "acceptance": [
    "produce: DESIGN draft",
    "produce: token drafts",
    "produce: Decision records",
    "satisfy or report gate: contract-consistency"
  ],
  "exitPolicy": "contracts validate without unresolved conflict",
  "nonGoals": [
    "pricing page",
    "documentation site",
    "backend"
  ],
  "omittedContext": [
    "unrelated project documents",
    "unrelated Run history",
    "Skills outside the active kit"
  ],
  "independenceControls": []
}
