{
  "runId": "run-cli-landing-001",
  "workflow": "CREATE",
  "phase": "intake",
  "role": "coordinator",
  "goal": "Classify Surface, decision level, autonomy, scope, constraints, and existing state.",
  "scope": [
    "cli-landing-page"
  ],
  "inputs": [
    "Design Work request"
  ],
  "locks": [],
  "openDecisions": [
    "creative direction",
    "composition",
    "typography",
    "motion"
  ],
  "authority": [
    "Own Run state, compile context, dispatch specialists, resolve transitions, and promote approved work.",
    "must not: author the final visual verdict",
    "must not: silently reopen Locks",
    "must not: dump all Skills into a Phase Packet"
  ],
  "skillKit": {
    "primary": null,
    "supporting": []
  },
  "outputSchema": "framework/schemas/handoff.schema.json",
  "acceptance": [
    "produce: Run Contract"
  ],
  "exitPolicy": "Run Contract validates",
  "nonGoals": [
    "pricing page",
    "documentation site",
    "backend"
  ],
  "omittedContext": [
    "unrelated project documents",
    "unrelated Run history",
    "Skills outside the active kit"
  ],
  "independenceControls": []
}
