{
  "runId": "run-cli-landing-001",
  "workflow": "CREATE",
  "phase": "visual-specimens",
  "role": "art-director",
  "goal": "Render enough of each Direction to judge hierarchy, signature, component language, and system potential.",
  "scope": [
    "cli-landing-page"
  ],
  "inputs": [
    "Direction candidates"
  ],
  "locks": [],
  "openDecisions": [
    "creative direction",
    "composition",
    "typography",
    "motion"
  ],
  "authority": [
    "Produce a coherent Direction grounded in product domain, with real compositional divergence and system potential.",
    "must not: see competing Directions during initial divergence",
    "must not: judge its own work as final critic",
    "must not: implement production code"
  ],
  "skillKit": {
    "primary": "chromarelay-art-direction",
    "supporting": [
      "interface-design",
      "ui-ux-pro-max"
    ]
  },
  "outputSchema": "framework/schemas/handoff.schema.json",
  "acceptance": [
    "produce: visual specimens",
    "produce: risk notes",
    "satisfy or report gate: direction-eligibility"
  ],
  "exitPolicy": "eligible candidates have comparable evidence",
  "nonGoals": [
    "pricing page",
    "documentation site",
    "backend"
  ],
  "omittedContext": [
    "unrelated project documents",
    "unrelated Run history",
    "Skills outside the active kit",
    "peer Direction candidates"
  ],
  "independenceControls": []
}
