{
  "runId": "run-cli-landing-001",
  "workflow": "CREATE",
  "phase": "direction-tournament",
  "role": "visual-critic",
  "goal": "Run blind pairwise comparisons and evaluate system potential.",
  "scope": [
    "cli-landing-page"
  ],
  "inputs": [
    "Product Brief",
    "anonymous specimens",
    "Direction contracts"
  ],
  "locks": [],
  "openDecisions": [
    "creative direction",
    "composition",
    "typography",
    "motion"
  ],
  "authority": [
    "Judge product fit, hierarchy, specificity, composition, typography, coherence, responsiveness, and craft from blind evidence.",
    "must not: read creator reasoning before first verdict",
    "must not: edit code",
    "must not: turn personal taste into a defect"
  ],
  "skillKit": {
    "primary": "chromarelay-critique",
    "supporting": [
      "interface-design"
    ]
  },
  "outputSchema": "framework/schemas/handoff.schema.json",
  "acceptance": [
    "produce: Tournament Report",
    "produce: Selected Direction or escalation",
    "satisfy or report gate: direction-tournament"
  ],
  "exitPolicy": "winner selected or human resolves material tie",
  "nonGoals": [
    "pricing page",
    "documentation site",
    "backend"
  ],
  "omittedContext": [
    "unrelated project documents",
    "unrelated Run history",
    "Skills outside the active kit",
    "creator identity",
    "creator reasoning",
    "detector report before first verdict",
    "which candidate is new"
  ],
  "independenceControls": [
    "hide creator identity",
    "hide creator reasoning"
  ]
}
